{
  "schema": "aicad_engineering_normative_preflight_v1",
  "contractId": "SIFC-220-REV-A-MECHANICAL-PREFLIGHT",
  "revision": 1,
  "domain": "mechanical",
  "deliveryStage": "review",
  "canonicalRulesSchema": "aicad_production_readiness_rules_v3",
  "canonicalRulesVersion": "3.0.0",
  "authorityOrder": [
    "selected_standard",
    "approved_engineering_input",
    "user_explicit_numeric",
    "user_explicit_semantic",
    "reference_cad",
    "reference_image",
    "inferred_assumption"
  ],
  "sources": [
    {
      "id": "STD_AUTHORITY",
      "kind": "selected_standard",
      "description": "Selected ISO GPS, fit, surface, edge, fastener and reference-temperature ledger for review-candidate generation.",
      "path": "runs/complex_servo_indexer_v116_20260820/standards-authority.md",
      "sha256": "3ac4f4e815ed8bd8df162f040e7e7389b05c51bf49f9acd07c61e8e65f485ac4"
    },
    {
      "id": "DESIGN_BASIS",
      "kind": "approved_engineering_input",
      "description": "Task-approved controlled-generation design basis for SIFC-220-REV-A; not production acceptance.",
      "path": "runs/complex_servo_indexer_v116_20260820/design-basis.md",
      "sha256": "9dd32bad245c844a2c2611b8c78957ab74adc410a6e3380c75528e142260e09f"
    },
    {
      "id": "ANALYSIS_BASIS",
      "kind": "approved_engineering_input",
      "description": "Independent preliminary strength, joint, bearing, thermal and tolerance calculations.",
      "path": "runs/complex_servo_indexer_v116_20260820/analysis-basis.md",
      "sha256": "f895f2145fdd03366717cae81a6baf8a0fdf25563578ce9f6b8662df12da7367"
    },
    {
      "id": "MFG_DEFINITION",
      "kind": "approved_engineering_input",
      "description": "Controlled material, process, GPS, finish, edge, fixturing and process-capability definition.",
      "path": "runs/complex_servo_indexer_v116_20260820/manufacturing-definition.md",
      "sha256": "d5828102d3d3b1d1bb326b7b679f24b39a50a15a02ffd744aa8ad78223befb74"
    },
    {
      "id": "INSPECTION_PLAN",
      "kind": "approved_engineering_input",
      "description": "Characteristic-to-method inspection closure at the 20 degree Celsius reference condition.",
      "path": "runs/complex_servo_indexer_v116_20260820/inspection-plan.md",
      "sha256": "0bc1bd196b6db9285e03ef0fcd0eead84a5e295ce195a57da3a93c325016aa42"
    }
  ],
  "applicableStandards": [
    {
      "standard": "ISO 8015:2011",
      "applicability": "GPS fundamentals",
      "sourceId": "STD_AUTHORITY",
      "scopeDecision": "Applicable to metric review-candidate generation of SIFC-220-REV-A within the stated GPS, fit, texture, edge, fastener or reference-temperature scope."
    },
    {
      "standard": "ISO 14405-1:2025",
      "applicability": "dimensional tolerancing",
      "sourceId": "STD_AUTHORITY",
      "scopeDecision": "Applicable to metric review-candidate generation of SIFC-220-REV-A within the stated GPS, fit, texture, edge, fastener or reference-temperature scope."
    },
    {
      "standard": "ISO 5459:2024",
      "applicability": "datums and datum systems",
      "sourceId": "STD_AUTHORITY",
      "scopeDecision": "Applicable to metric review-candidate generation of SIFC-220-REV-A within the stated GPS, fit, texture, edge, fastener or reference-temperature scope."
    },
    {
      "standard": "ISO 1101:2017",
      "applicability": "geometrical tolerancing",
      "sourceId": "STD_AUTHORITY",
      "scopeDecision": "Applicable to metric review-candidate generation of SIFC-220-REV-A within the stated GPS, fit, texture, edge, fastener or reference-temperature scope."
    },
    {
      "standard": "ISO 22081:2021",
      "applicability": "general geometrical and size specifications",
      "sourceId": "STD_AUTHORITY",
      "scopeDecision": "Applicable to metric review-candidate generation of SIFC-220-REV-A within the stated GPS, fit, texture, edge, fastener or reference-temperature scope."
    },
    {
      "standard": "ISO 13715:2017",
      "applicability": "edges of undefined shape",
      "sourceId": "STD_AUTHORITY",
      "scopeDecision": "Applicable to metric review-candidate generation of SIFC-220-REV-A within the stated GPS, fit, texture, edge, fastener or reference-temperature scope."
    },
    {
      "standard": "ISO 21920-1:2021",
      "applicability": "surface texture indication",
      "sourceId": "STD_AUTHORITY",
      "scopeDecision": "Applicable to metric review-candidate generation of SIFC-220-REV-A within the stated GPS, fit, texture, edge, fastener or reference-temperature scope."
    },
    {
      "standard": "ISO 1:2022",
      "applicability": "reference temperature for specification and verification",
      "sourceId": "STD_AUTHORITY",
      "scopeDecision": "Applicable to metric review-candidate generation of SIFC-220-REV-A within the stated GPS, fit, texture, edge, fastener or reference-temperature scope."
    },
    {
      "standard": "ISO 2768-1:1989",
      "applicability": "general linear and angular tolerances when invoked",
      "sourceId": "STD_AUTHORITY",
      "scopeDecision": "Applicable to metric review-candidate generation of SIFC-220-REV-A within the stated GPS, fit, texture, edge, fastener or reference-temperature scope."
    },
    {
      "standard": "ISO 286-1:2010",
      "applicability": "limits and fits basis when invoked",
      "sourceId": "STD_AUTHORITY",
      "scopeDecision": "Applicable to metric review-candidate generation of SIFC-220-REV-A within the stated GPS, fit, texture, edge, fastener or reference-temperature scope."
    },
    {
      "standard": "ISO 286-2:2010",
      "applicability": "limit deviations for holes and shafts when invoked",
      "sourceId": "STD_AUTHORITY",
      "scopeDecision": "Applicable to metric review-candidate generation of SIFC-220-REV-A within the stated GPS, fit, texture, edge, fastener or reference-temperature scope."
    },
    {
      "standard": "ISO 965-1:2026",
      "applicability": "metric thread tolerances when invoked",
      "sourceId": "STD_AUTHORITY",
      "scopeDecision": "Applicable to metric review-candidate generation of SIFC-220-REV-A within the stated GPS, fit, texture, edge, fastener or reference-temperature scope."
    },
    {
      "standard": "ISO 898-1:2013",
      "applicability": "steel fastener properties when invoked",
      "sourceId": "STD_AUTHORITY",
      "scopeDecision": "Applicable to metric review-candidate generation of SIFC-220-REV-A within the stated GPS, fit, texture, edge, fastener or reference-temperature scope."
    },
    {
      "standard": "ISO 16047:2005+Amd 1:2012",
      "applicability": "fastener torque-clamp testing when invoked",
      "sourceId": "STD_AUTHORITY",
      "scopeDecision": "Applicable to metric review-candidate generation of SIFC-220-REV-A within the stated GPS, fit, texture, edge, fastener or reference-temperature scope."
    }
  ],
  "ruleApplications": [
    {
      "gatePath": "mechanical.intent.wholeIntent",
      "disposition": "constrained",
      "requirement": "Resolve canonical gate mechanical.intent.wholeIntent before controlled generation. The generated design and its later evidence plan must bind /intent/wholeIntent to the rule-owned expected value true.",
      "sourceIds": [
        "STD_AUTHORITY",
        "DESIGN_BASIS"
      ],
      "verificationMethod": "Verify exact source hashes, requirement-contract bindings and standards-ledger identity before any geometry.",
      "generationConstraint": "Freeze part SIFC-220-REV-A as a dual-6208 servo-indexer flange cartridge with the declared function, 220 x 180 x 56 mm envelope, review delivery stage and no production claim.",
      "standardIds": [
        "ISO 8015:2011",
        "ISO 14405-1:2025"
      ]
    },
    {
      "gatePath": "mechanical.intent.dimensionalAuthority",
      "disposition": "constrained",
      "requirement": "Resolve canonical gate mechanical.intent.dimensionalAuthority before controlled generation. The generated design and its later evidence plan must bind /intent/dimensionalAuthority to the rule-owned expected value true.",
      "sourceIds": [
        "STD_AUTHORITY",
        "DESIGN_BASIS"
      ],
      "verificationMethod": "Verify exact source hashes, requirement-contract bindings and standards-ledger identity before any geometry.",
      "generationConstraint": "Derive every hard model and drawing dimension from design-basis.md; screen pixels, visual proportions and unconstrained inferred dimensions are forbidden.",
      "standardIds": [
        "ISO 8015:2011",
        "ISO 14405-1:2025"
      ]
    },
    {
      "gatePath": "mechanical.intent.materialAuthority",
      "disposition": "constrained",
      "requirement": "Resolve canonical gate mechanical.intent.materialAuthority before controlled generation. The generated design and its later evidence plan must bind /intent/materialAuthority to the rule-owned expected value true.",
      "sourceIds": [
        "STD_AUTHORITY",
        "DESIGN_BASIS"
      ],
      "verificationMethod": "Verify exact source hashes, requirement-contract bindings and standards-ledger identity before any geometry.",
      "generationConstraint": "Assign EN AW-7075-T651 to the native part and drawing; material substitution requires a new design basis and recalculation.",
      "standardIds": [
        "ISO 8015:2011",
        "ISO 14405-1:2025"
      ]
    },
    {
      "gatePath": "mechanical.intent.processAuthority",
      "disposition": "constrained",
      "requirement": "Resolve canonical gate mechanical.intent.processAuthority before controlled generation. The generated design and its later evidence plan must bind /intent/processAuthority to the rule-owned expected value true.",
      "sourceIds": [
        "STD_AUTHORITY",
        "DESIGN_BASIS"
      ],
      "verificationMethod": "Verify exact source hashes, requirement-contract bindings and standards-ledger identity before any geometry.",